{
  "schema": "mimesis.current-state-summary.v0.1",
  "snapshotKind": "generated_local_state_snapshot",
  "status": "open_gates_remain",
  "generatedAt": "2026-06-11T13:41:19.956Z",
  "package": {
    "name": "mimesis-engineering",
    "version": "0.1.0",
    "private": true,
    "license": "UNLICENSED"
  },
  "git": {
    "branch": "codex/mimesis-framework-v0.1",
    "upstream": "origin/codex/mimesis-framework-v0.1",
    "head": "09c2701225a072180efb9302bb092ca5c486fba4",
    "dirty": true,
    "trackedChangedCount": 37,
    "untrackedCount": 7,
    "freshness": "generation_time_only",
    "committedSnapshotCanGoStale": true,
    "liveVerificationCommand": "npm run audit:sync:strict"
  },
  "completionAllowed": false,
  "gapCount": 9,
  "counts": {
    "byStatus": {
      "needs_fresh_verification": 1,
      "pending_owner": 1,
      "waiting_for_artifact": 2,
      "blocked": 3,
      "waiting_for_evidence": 2
    },
    "blocked": 3,
    "pendingOwner": 1,
    "waitingForArtifact": 2,
    "waitingForEvidence": 2
  },
  "gates": [
    {
      "id": "strict_publish_sync",
      "title": "Strict publish sync gate",
      "kind": "git_sync",
      "status": "needs_fresh_verification",
      "closureType": "local_sync_gate",
      "requiredEvidence": [
        "npm run audit:sync:strict",
        ".mimesis/sync-status.md"
      ],
      "nextAction": "Run the runtime-only non-writing strict sync gate after the intended branch is pushed.",
      "firstCommand": "npm run audit:sync",
      "stopConditions": [
        "Stop if the worktree is dirty and no owner has requested staging, committing, pushing, tagging, releasing, or publishing.",
        "Stop if upstream sync cannot be verified from the local git state."
      ],
      "boundary": "Committed gap-register snapshots do not close strict sync; only the runtime-only non-writing strict sync audit proves current local upstream sync."
    },
    {
      "id": "owner_license_decision",
      "title": "Owner license decision",
      "kind": "owner_decision",
      "status": "pending_owner",
      "closureType": "owner_decision_gate",
      "requiredEvidence": [
        "docs/LICENSE-DECISION.md",
        ".mimesis/license-packets/owner-decision.md"
      ],
      "nextAction": "Owner chooses a reuse license or keeps the no-reuse boundary.",
      "firstCommand": "npm run license:packet",
      "stopConditions": [
        "Stop if no owner decision exists.",
        "Stop if the request would require legal advice."
      ],
      "boundary": "Does not choose a license or provide legal advice."
    },
    {
      "id": "permissioned_external_artifact",
      "title": "One permissioned external weak artifact",
      "kind": "external_artifact",
      "status": "waiting_for_artifact",
      "closureType": "permissioned_artifact_gate",
      "requiredEvidence": [
        "docs/PROOF-INTAKE-KIT.md",
        ".mimesis/proof-intake/first-external-proof-kit.md"
      ],
      "nextAction": "Collect one user-submitted, permissioned, or clearly redacted weak artifact.",
      "firstCommand": "npm run proof:intake",
      "stopConditions": [
        "Stop if permission, redaction, or submitter scope is unclear.",
        "Stop if the artifact contains secrets or private personal data that should not enter the case trail."
      ],
      "boundary": "Does not create external proof or grant permission."
    },
    {
      "id": "completed_external_case",
      "title": "Completed permissioned before/after case",
      "kind": "proof_case",
      "status": "waiting_for_artifact",
      "closureType": "proof_case_gate",
      "requiredEvidence": [
        "npm run cli -- case:review path/to/intake.md",
        "npm run cli -- case:from-intake path/to/intake.md",
        "npm run cli -- case:check path/to/case"
      ],
      "nextAction": "Run the reviewed artifact through the full case path and preserve the boundary check.",
      "firstCommand": "npm run cli -- case:review path/to/intake.md",
      "stopConditions": [
        "Stop if the case lacks before/after artifacts.",
        "Stop if the boundary check does not preserve what remains unproven.",
        "Stop if reviewed evidence is missing."
      ],
      "boundary": "Does not prove improvement, adoption, or outcome until the before/after case evidence exists."
    },
    {
      "id": "package_publication",
      "title": "npm package publication",
      "kind": "publication",
      "status": "blocked",
      "closureType": "publication_gate",
      "requiredEvidence": [
        "docs/PACKAGE-RELEASE-CANDIDATE.md",
        "npm run audit:package",
        "owner-controlled npm publish evidence"
      ],
      "nextAction": "After license and sync gates close, owner decides whether npm publication is in scope.",
      "firstCommand": "npm run audit:package",
      "stopConditions": [
        "Stop if package.json remains private.",
        "Stop if the license decision is pending.",
        "Stop if strict sync has not passed."
      ],
      "boundary": "Dry-run package checks are not npm publication."
    },
    {
      "id": "action_publication",
      "title": "Tagged GitHub Action or Marketplace publication",
      "kind": "publication",
      "status": "blocked",
      "closureType": "publication_gate",
      "requiredEvidence": [
        "docs/ACTION-RELEASE-CANDIDATE.md",
        "npm run audit:action",
        "tag or Marketplace release evidence"
      ],
      "nextAction": "Owner decides whether a tagged public action release or Marketplace listing is in scope.",
      "firstCommand": "npm run audit:action",
      "stopConditions": [
        "Stop if no tag or Marketplace release evidence exists.",
        "Stop if the repository-local action metadata is the only evidence."
      ],
      "boundary": "Repository-local action metadata is not Marketplace publication."
    },
    {
      "id": "shipped_plugin",
      "title": "Shipped plugin or connector proof",
      "kind": "integration",
      "status": "blocked",
      "closureType": "integration_gate",
      "requiredEvidence": [
        "docs/PLUGIN-RELEASE-PACKET.md",
        ".mimesis/plugin-release-packets/v0.1-action-candidate.md",
        "installation or release evidence packet"
      ],
      "nextAction": "Produce a real tagged plugin/action release or installation proof before shipped-plugin claims.",
      "firstCommand": "npm run plugin:install-packet",
      "stopConditions": [
        "Stop if only local plugin scaffolds exist.",
        "Stop if no install or release evidence can be attached."
      ],
      "boundary": "Local plugin scaffolds and install-readiness packets are not shipped plugins."
    },
    {
      "id": "benchmark_study",
      "title": "Benchmarked productivity evidence",
      "kind": "measurement",
      "status": "waiting_for_evidence",
      "closureType": "measurement_gate",
      "requiredEvidence": [
        "docs/BENCHMARK-PACKET.md",
        ".mimesis/benchmark-packets/v0.2-first-benchmark.md",
        "reviewed evidence packet"
      ],
      "nextAction": "Run the measurement protocol and review the resulting evidence before productivity claims.",
      "firstCommand": "npm run benchmark:packet",
      "stopConditions": [
        "Stop if no measured before/after study exists.",
        "Stop if evidence has not been reviewed."
      ],
      "boundary": "Measurement protocol only; no benchmark claim without direct evidence."
    },
    {
      "id": "external_adoption",
      "title": "External adoption evidence",
      "kind": "adoption",
      "status": "waiting_for_evidence",
      "closureType": "adoption_gate",
      "requiredEvidence": [
        "templates/evidence-packet.md",
        "reviewed adoption evidence packet"
      ],
      "nextAction": "Collect and review real external usage evidence before adoption claims.",
      "firstCommand": "Create or collect a reviewed adoption evidence packet from templates/evidence-packet.md.",
      "stopConditions": [
        "Stop if public repository visibility is the only evidence.",
        "Stop if the evidence is not external, permissioned, or reviewed."
      ],
      "boundary": "Read-only public repository visibility is not external adoption."
    }
  ],
  "nextBestActions": [
    {
      "id": "strict_publish_sync",
      "nextAction": "Run the runtime-only non-writing strict sync gate after the intended branch is pushed.",
      "boundary": "Committed gap-register snapshots do not close strict sync; only the runtime-only non-writing strict sync audit proves current local upstream sync."
    },
    {
      "id": "owner_license_decision",
      "nextAction": "Owner chooses a reuse license or keeps the no-reuse boundary.",
      "boundary": "Does not choose a license or provide legal advice."
    },
    {
      "id": "permissioned_external_artifact",
      "nextAction": "Collect one user-submitted, permissioned, or clearly redacted weak artifact.",
      "boundary": "Does not create external proof or grant permission."
    }
  ],
  "sourceFiles": [
    ".mimesis/gaps/current-gap-register.json",
    ".mimesis/gaps/closure-plan.json",
    ".mimesis/gates/current-gateboard.md",
    ".mimesis/owner-actions/current-action-queue.md",
    ".mimesis/release-evidence/v0.1-report.md"
  ],
  "boundaries": [
    "does_not_close_gates",
    "does_not_prove_completion",
    "does_not_publish",
    "does_not_stage_commit_push_tag_release",
    "does_not_choose_license",
    "does_not_create_external_proof",
    "does_not_prove_adoption"
  ],
  "allowedClaim": "Mimesis has a local current state summary that is a generation-time snapshot, not proof; it summarizes open gates and next actions from existing local packets.",